ad_id,origin,condition,car_model,mileage,exterior_color,interior_color,num_of_doors,seating_capacity,engine,fuel_system,transmission,drive_type,fuel_consumption,describe,brand,grade,year_of_manufacture,car_name,price,url
4819237,Domestic assembly,Used car,SUV,"100,000 Km",Take note,Yellow,5-door,8-seat,Diesel	2.5 L, Oil,Manual,RFD - Rear-wheel drive,7	L/100Km," Everest car for sale, manual transmission, diesel engine, 2007. Hanoi license plate. Commitment to a beautiful car, a solid mechanical clutch, not a bit redundant, now no need to use, want to sell, price available at Loc. See the car at Thanh Xuan Hanoi",Ford,Everest,2007.0,Ford Everest 2.5L 4x2 MT 2007,240000000,https://bonbanh.com/xe-ford-everest-2.5l-4x2-mt-2007-4819237
4861058,Domestic assembly,Used car,Sedan,"200,000 Km",Black,Cream,4-door,5-seat,Petrol	2.4 L,,Manual,FWD - Front-wheel drive,L/100Km," Selling a Toyota Camry 2.4G, 2004, black, manual transmission, 95% beautiful. Genuine wheels replaced 4 Machelin shells, genuine leather seats according to the car, Android screen. Genuine machinery, quiet. - Price is still negotiable, you need to contact me.",Toyota,Camry,2004.0,Toyota Camry 2.4G 2004,250000000,https://bonbanh.com/xe-toyota-camry-2.4g-2004-4861058
4898368,Domestic assembly,Used car,Van/Minivan,"100,000 Km",Silver,Silver,5-door,2-seat,Petrol	0.8 L,,Manual,FWD - Front-wheel drive,L/100Km," I am selling a Chevrolet Spark Van (2 seats) - Manufactured in 2011 - Odo 100,000km - The car is guaranteed to not crash or flood!! The engine is smooth and runs well. Thank you for watching",Chevrolet,Spark,2011.0,Chevrolet Spark Van 0.8 MT 2011,89000000,https://bonbanh.com/xe-chevrolet-spark-van-0.8-mt-2011-4898368
4822023,Domestic assembly,Used car,Sedan,0 Km,Silver,Cream,4-door,5-seat,Petrol	1.6 L,,Manual,FWD - Front-wheel drive,L/100Km," I've moved on, so I need to get rid of my 2004 m3 mt, the car is clean with enthusiasm, the tires are jingling, the engine is smooth, the air conditioner is tingling, the legs are clean, the tires are newly replaced, the mirrors are electric, the oil is new, the tires are new. Backup hasn't been lowered yet, full Android dash cam, just buy gas and drive, don't spend a dime on the garage, guarantee the car won't crash or flood, my family car has very low mileage.",Mazda,3,2004.0,Mazda 3 1.6 MT 2004,185000000,https://bonbanh.com/xe-mazda-3-1.6-mt-2004-4822023
4890711,Imported,Used car,Crossover,0 Km,Silver,Colorful,5-door,7-seat,Diesel	2.0 L,,Manual,FWD - Front-wheel drive,L/100Km," SELLING 2008 Kia Caren diesel engine, imported manual transmission, smooth transmission, genuine transmission, please call if it fits your needs.",Kia,Carens,2008.0,Kia Carens CRDi 2.0 MT 2008,235000000,https://bonbanh.com/xe-kia-carens-crdi-2.0-mt-2008-4890711
4567920,Domestic assembly,New car,Van/Minivan,0 Km,Black,Colorful,4-door,11-seat,Diesel	2.5 L,high pressure fuel injection pump,Manual,RFD - Rear-wheel drive,9	L/100Km," Hyundai Solati Dcar Business Automatic sliding door, anti-jamming, remote control, high-end DACR Body Kit, all glass covered with heat-insulating film. Contact for more information!",Hyundai,Solati,2022.0,Hyundai Solati Dcar 2022,1483000000,https://bonbanh.com/xe-hyundai-solati-dcar-2022-4567920
4840850,Domestic assembly,Used car,Bán tải / Pickup,0 Km,Black,-,4-door,5-seat,Diesel	2.5 L,,Manual,4WD - Four-wheel drive (4WD),L/100Km," Selling a 2008 Ford Ranger 2-wheel drive manual transmission. Full papers, title transfer in a snap, engine free of cold air conditioning. Hanoi license plate. Just completed registration and selling to someone going to work.",Ford,Ranger,2008.0,Ford Ranger XLT 4x4 MT 2008,200000000,https://bonbanh.com/xe-ford-ranger-xlt-4x4-mt-2008-4840850
4816054,Imported,Used car,Hatchback,"76,888 Km",Red,Cream,5-door,5-seat,Petrol	1.0 L,Fi,Manual,FWD - Front-wheel drive,5	L/100Km,"I'm selling a beautiful i10 car with a no-fault guarantee, ensuring you won't lose your job when viewing the car. 4 layers of new jackfruit reversing camera. Long private Android screen journey in general, very suitable for those who are looking to go. pick up your children and return to your hometown on the weekend for more information about the car as well as the best price, please contact me. Thank you for your interest!",Hyundai,i10,2014.0,Hyundai i10 Grand 1.0 MT 2014,185000000,https://bonbanh.com/xe-hyundai-i10-grand-1.0-mt-2014-4816054
4587314,Imported,Used car,Truck,"140,000 Km",White,-,2-door,2-seat,Petrol	1.6 L,,Manual,RFD - Rear-wheel drive,10	L/100Km,"Individual selling imported Suzuki truck from Indonesia, one owner from scratch, stainless steel box, original car with no collisions, floods, original engine.",Suzuki,Carry,2016.0,Suzuki Carry Pro 2016,180000000,https://bonbanh.com/xe-suzuki-carry-pro-2016-4587314
4823480,Imported,Used car,Van/Minivan,"2,200,000 Km",Take note,gray,5-door,3-seat,Diesel	2.5 L,,Manual,RFD - Rear-wheel drive,7	L/100Km," want to sell a Hyundai starex2008, a manual transmission, diesel engine, a 3-seater, an 800-pound vehicle with original tires, not a renovated vehicle, a motorbike with original chassis and body, I want to sell it to exchange for a bigger car. If anyone is interested, please contact me.",Hyundai,Grand Starex,2008.0,Hyundai Grand Starex Van 2.5 MT 2008,278000000,https://bonbanh.com/xe-hyundai-grand_starex-van-2.5-mt-2008-4823480
4890557,Domestic assembly,Used car,Crossover,"115,000 Km",Take note,Colorful,5-door,8-seat,Petrol	2.0 L,,Manual,RFD - Rear-wheel drive,L/100Km," For sale Toyota innova gray yellow 2016 E, genuine family car, not for business, anyone to contact for more details",Toyota,Innova,2016.0,Toyota Innova 2.0E 2016 car,405000000,https://bonbanh.com/xe-toyota-innova-2.0e-2016-4890557
4635194,Domestic assembly,Used car,SUV,"110,000 Km",Pink,Cream,5-door,8-seat,Diesel	2.5 L,,Manual,RFD - Rear-wheel drive,L/100Km," Ford everest 2013 has a 2.5 4x 2 manual transmission with 110,000 km of driving, no business vehicle, smooth engine, good engine with clean cam, rear cam, real crib, creamy color, nice lipstick, light weight, no water damage.",Ford,Everest,2013.0,Ford Everest 2.5L 4x2 MT 2013,420000000,https://bonbanh.com/xe-ford-everest-2.5l-4x2-mt-2013-4635194
4911610,Domestic assembly,Used car,Hatchback,0 Km,Red,Black,5-door,5-seat,Petrol	1.25 L,,Manual,FWD - Front-wheel drive,L/100Km,"Kia Morning 2015 car for sale, beautiful car, no faults, original engine, new tires with long registration, cast wheels, 10 inch screen. Contact for more information!",Kia,Morning,2015.0,Kia Morning MT 2015 car,175000000,https://bonbanh.com/xe-kia-morning-mt-2015-4911610
4799300,Imported,Used car,Truck,0 Km,Green,gray,2-door,3-seat,Diesel,,Manual,RFD - Rear-wheel drive,L/100Km," VIP vip vip Private car, injector engine, solid chassis, good engine, smooth engine, cool air conditioning, nice tires, just serviced, ready to go.",Kia,Frontier,2002.0,Kia Frontier 2002,89000000,https://bonbanh.com/xe-kia-frontier--2002-4799300
4813406,Domestic assembly,Used car,Van/Minivan,"13,000 Km",Black,Black,4-door,10-seat,Diesel	2.4 L,Turbo high pressure injection,Manual,RFD - Rear-wheel drive,L/100Km,"Genuine upgraded cars cost more than 1 billion in upgrade fees, so you can rest assured about the registration records. Look at the fact that the current selling price is too cheap, guys. The upgraded interior does not have the smell of leather or plastic. Almost full upgrade items include 4 Massage chairs, electric curtains, ceiling lights combined with beautiful wood paneling materials like RollRoyce, raised and lowered TV to separate the cockpit, electric doors, safe, refrigerator, table and chairs. cupboard, air tank lift system and 2 electric doors as well as Fifi transmitter system and intercom phone. The car is currently only 13,000 km from Odo. Rodai is mechanically smooth, so it operates in the best condition of the car. If you are interested, connect to Zalo and I will send clear and authentic pictures. Please feel free to test the car",Ford,Transit,2015.0,Ford Transit Limousine 2015,850000000,https://bonbanh.com/xe-ford-transit-limousine-2015-4813406
4832785,Imported,Used car,Hatchback,0 Km,Silver,Colorful,5-door,5-seat,Petrol	1.1 L,,Manual,FWD - Front-wheel drive,L/100Km," CD 5 production 2000 car has no errors, minor power steering, genuine tiger car, cleaned up with more than 90 million, changed car to another car, includes authorization, car inspection, contact person, CV is busy so message waiting for response, price will not be reduced.",Kia,Pride,2000.0,Kia Pride CD5 2000 car,76000000,https://bonbanh.com/xe-kia-pride-cd5-2000-4832785
4851932,Imported,Used car,Truck,"12,345 Km",Green,Black,2-door,3-seat,Diesel,Electronic fuel injection,Manual,RFD - Rear-wheel drive,10	L/100Km," I need to sell a hyundai 2.5 ton x beautiful car. No collision. If you are interested, please contact me directly. Thank you.",Hyundai,HD,2005.0,Hyundai HD 65 2005 car,150000000,https://bonbanh.com/xe-hyundai-hd-65-2005-4851932
4827383,Domestic assembly,Used car,Sedan,0 Km,Take note,gray,4-door,5-seat,Petrol	1.6 L,,Manual,FWD - Front-wheel drive,L/100Km," For sale Kia Spectra 2003 Privately. Very good mechanicals, cool air conditioning. Nice interior, good paint. Complete radio screen, 4 cast wheels, new tires Electric mirrors, windows work well .Full function, Registration still intact. The price of a 2-head Sedan is very cheap. Anyone who buys it for family use, running services in the village or commune is too Ok, the price is the same as a new motorbike.",Kia,Spectra,2003.0,Kia Spectra 1.6 MT 2003,55000000,https://bonbanh.com/xe-kia-spectra-1.6-mt-2003-4827383
4473820,Imported,New car,Sedan,0 Km,Grey,Black,4-door,5-seat,Petrol	1.2 L,,Manual,FWD - Front-wheel drive,5	L/100Km,❗❗The car is available for immediate delivery within the month. 50% registration fee bonus Reverse camera comes with the car. 100% lucky draw voucher worth 6 million 8 million 20 million - Contact now to get the best offer - 15 alloy wheels -inch two-tone- Electric rearview mirror- 7-inch touch screen- Remote door lock- Anti-theft key- Electric power steering- 6-way manual driver's seat- Seat belt warning- Anti-lock braking system (ABS) - Electronic brake force distribution system (EBD),Mitsubishi,Attrage,2023.0,Mitsubishi Attrage 1.2 MT 2023,380000000,https://bonbanh.com/xe-mitsubishi-attrage-1.2-mt-2023-4473820
4922662,Domestic assembly,Used car,Van/Minivan,"20,000 Km",Take note,Brown,4-door,16-seat,Diesel	2.2 L,Tubo,Manual,RFD - Rear-wheel drive,9	L/100Km,"Selling a 2007 16-seat Mercedes Spinte car in high quality condition. The machine runs smoothly and strong. Deep air conditioning, 4 brand new tires, decree orange and cruise orange available. Please contact to see the car at Dong Anh Hanoi.",Mercedes Benz,Sprinter,2007.0,Mercedes Benz Sprinter 311 CDI 2.2L 2007,180000000,https://bonbanh.com/xe-mercedes_benz-sprinter-311-cdi-2.2l-2007-4922662
4841787,Domestic assembly,Used car,Crossover,"89,000 Km",Yellow,Sand,5-door,8-seat,Petrol	2.0 L,,Manual,RFD - Rear-wheel drive,9	L/100Km," Toyota Innova E 2016 for sale in golden brown color. Family car with owner not in business. Zin intact inside and out. Zin felt seats. Full toys attached to the car. The car is as real as the picture posted, looking forward to welcoming willing buyers",Toyota,Innova,2016.0,Toyota Innova 2.0E 2016 car,370000000,https://bonbanh.com/xe-toyota-innova-2.0e-2016-4841787
4523571,Domestic assembly,Used car,Van/Minivan,"150,000 Km",Silver,Green,4-door,10-seat,Petrol	2.7 L,,Manual,RFD - Rear-wheel drive,9	L/100Km," Toyota Hiace 2009 high-end Super Wagon version, super nice car, ODO more than 15 thousand. The car is an extremely rare collectible on the market. Please contact directly for a good price!",Toyota,Hiace,2009.0,Toyota Hiace Super Wagon 2.7 2009,280000000,https://bonbanh.com/xe-toyota-hiace-super-wagon-2.7-2009-4523571
4807334,Domestic assembly,Used car,SUV,"205,484 Km",Green,gray,5-door,7-seat,Petrol	3.0 L,,Manual,4WD - Four-wheel drive (4WD),10	L/100Km," need to sell a car - Mitsubishi Pajero GL, manufactured in 2000, personal name, Hanoi license plate, 7 seats, beautiful interior and exterior, 2 axles in good working order, running smoothly, registered until 4/2023 1. The engine, clutch and axle system along with the ability to operate are still very perfect. 2. The body is not rotten, there are no signs of heavy collision, the iron is still like new! 3. The interior is still beautiful, leather seats, felt ceiling, plastic furniture are still beautiful, very suitable for those who go to the forest, fields, as well as farms!!",Mitsubishi,Pajero,2000.0,Mitsubishi Pajero 3.0 2000,85000000,https://bonbanh.com/xe-mitsubishi-pajero-3.0-2000-4807334
4916822,Domestic assembly,Used car,Hatchback,"120,000 Km",Silver,Colorful,5-door,5-seat,Petrol	1.25 L,Gasoline,Manual,FWD - Front-wheel drive,6	L/100Km," Morning Si 1.25 MT 2015, private car, license plate 99 Excellent car, toys all over the car: full screen, camera No minor defects, original transmission only Beautiful one of a kind interior All functions perfect Hello See the car here Khoai Chau - Hung Yen",Kia,Morning,2015.0,Kia Morning Si MT 2015 car,210000000,https://bonbanh.com/xe-kia-morning-si-mt-2015-4916822
4906212,Domestic assembly,Used car,Hatchback,"87,000 Km",Red,Grey,5-door,5-seat,Petrol	1.25 L,Crazy fuel injection,Manual,FWD - Front-wheel drive,6	L/100Km,"Selling a 2016 Kia Morning, red with manual transmission, quality car, beautiful, original, no minor defects, no crashes, no flooding. Smooth gearshift, free running, equipped with Android screen, reversing camera, heat insulation film, 4 newly replaced tires.... If interested, please contact.....",Kia,Morning,2016.0,Kia Morning EX 2016 car,198000000,https://bonbanh.com/xe-kia-morning-ex-2016-4906212
4848509,Domestic assembly,Used car,Sedan,"18,000 Km",White,White,4-door,5-seat,Petrol	1.5 L,EFI,Manual,FWD - Front-wheel drive,6	L/100Km,"Vios version G 1.5, 2005, family car from the beginning, no service, beautiful original car, now I want to sell. If you love beauty, please contact me for specific information.",Toyota,Vios,2005.0,Toyota Vios 1.5G 2005,155000000,https://bonbanh.com/xe-toyota-vios-1.5g-2005-4848509
4853736,Imported,Used car,Bán tải / Pickup,"96,000 Km",Green,Black,4-door,5-seat,Diesel	2.2 L,,Manual,RFD - Rear-wheel drive,L/100Km," PHUC DUONG AUTO SELLING FORD RANGER 2013 - BLUE - 96,000KM. Family car bought by the original owner from the beginning, genuine warranty. Black interior, high quality leather seats. VCD screen, diesel engine, exhaust, imported complete unit, runs strong and saves materials. Anyone who wants to see the car will be satisfied immediately.",Ford,Ranger,2013.0,Ford Ranger XLS 2.2L 4x2 MT 2013,380000000,https://bonbanh.com/xe-ford-ranger-xls-2.2l-4x2-mt-2013-4853736
4921167,Domestic assembly,Used car,Hatchback,0 Km,Red,Cream,5-door,5-seat,Petrol	1.25 L,,Manual,FWD - Front-wheel drive,L/100Km,"Kia Moning SI Sport Manufactured in 2018, the car was purchased by the owner and used by the family. Customers need to ensure that they are satisfied. The store specializes in selling beautiful cars with prestige - Quality, always reasonable prices. The car is fully equipped with features: Airbags, Abs brakes, built-in steering wheel. Suitable, felt ceiling covered with nylon from new, Adjoj screen, ball lights, headlights, electric mirrors, electric windows, remote control key, new tires, mirror turn signals... Contact Toan Thang Auto Market - Ninh Binh for more information Detailed information and the most preferential prices... The store commits to not selling defective cars, not selling service taxis.. Sales and warranty nationwide... Sincerely thank you!!",Kia,Morning,2018.0,Kia Morning Si MT 2018 car,269000000,https://bonbanh.com/xe-kia-morning-si-mt-2018-4921167
4851041,Domestic assembly,Used car,Sedan,"90,000 Km",Silver,Cream,4-door,5-seat,Petrol	1.5 L,,Manual,FWD - Front-wheel drive,6	L/100Km,"Original car. Guaranteed to be error-free, if there is a crash, flooding or any error related to the engine chassis, please donate the car!",Toyota,Vios,2013.0,Toyota Vios 1.5E 2013,283000000,https://bonbanh.com/xe-toyota-vios-1.5e-2013-4851041
4922093,Domestic assembly,Used car,Sedan,0 Km,Yellow,gray,4-door,5-seat,Petrol	1.5 L,,Manual,FWD - Front-wheel drive,L/100Km," Vios MT 2014, original motorbike, solid chassis, original body, beautiful interior, full reverse cam screen",Toyota,Vios,2014.0,Toyota Vios 1.5E 2014,250000000,https://bonbanh.com/xe-toyota-vios-1.5e-2014-4922093
4899508,Domestic assembly,Used car,Sedan,0 Km,Black,Cream,4-door,5-seat,Petrol	1.6 L,,Manual,FWD - Front-wheel drive,L/100Km," Lacetti manufactured in 2010, original engine, solid chassis, cool air conditioning even in hot weather, guaranteed original car If interested, please contact for more detailed information.",Daewoo,Lacetti,2010.0,Daewoo Lacetti EX 2010 car,140000000,https://bonbanh.com/xe-daewoo-lacetti-ex-2010-4899508
4899628,Domestic assembly,New car,Truck,0 Km,White,Grey,2-door,3-seat,Diesel,Direct fuel injection,Manual,RFD - Rear-wheel drive,10	L/100Km,"Hyundai 75S canvas 3T5 Engine code D4GA, Euro IV Engine type Turbocharged, 4-stroke, 4-cylinder in line, liquid-cooled Working capacity (cc) 3933 Maximum power (Ps) 103 / 2700 Weight Body 3000/3810/3205 Allowed weight 1800/3495/4100 Gross weight 4995/7500 Vehicle dimensions (LxWxH)mm 6430 x 2190 x 2870 Box size (LxWxH)mm 4410 x 2,060 x 680/1,840(tarpaulin), 4 410 x 2,060 x 1,840 (closed) Manual transmission, 5 forward, 1 reverse Rims & Tires 7.00-R16 Other equipment Power steering, tilt steering wheel, electric windows, air conditioning, radio + AUX +USB",Hyundai,Mighty,2023.0,Hyundai Mighty 75S-3.5T canvas car 2023,719000000,https://bonbanh.com/xe-hyundai-mighty-75s-3_5t-thung-bat-2023-4899628
4819698,Imported,Used car,Bán tải / Pickup,0 Km,White,gray,4-door,5-seat,Diesel	2.2 L,,Manual,4WD - Four-wheel drive (4WD),L/100Km, For sale BT50 2014MT manual transmission oil Commitment to not crash or floodNew tires with long registration Contact to see the car,Mazda,BT50,2014.0,Mazda BT50 2.2L 4x4 MT 2014,420000000,https://bonbanh.com/xe-mazda-bt50-2.2l-4x4-mt-2014-4819698
4899819,Domestic assembly,Used car,Crossover,"150,000 Km",Silver,Black,5-door,7-seat,Petrol	2.0 L,2.0,Manual,FWD - Front-wheel drive,9	L/100Km," Because I don't need to use it, I'm selling the Kia Carens 2010, registered 2011, 2.0 version, complete with integrated steering wheel, sunroof, and LED lights. Buy the car and use it immediately, you don't have to do anything. Who needs LH?",Kia,Carens,2010.0,Kia Carens EX 2.0 MT 2010,190000000,https://bonbanh.com/xe-kia-carens-ex-2.0-mt-2010-4899819
4908872,Imported,Used car,Truck,0 Km,Silver,gray,2-door,2-seat,Petrol	1.6 L,,Manual,RFD - Rear-wheel drive,L/100Km," Original owner suzuki pro 2013 engine is in good condition, air conditioner has shrunken spark plugs, frame is painted in flat zin, sealed box, 620kg imported from India, car has been well maintained, 1 owner, ace qtam, contact me to see the car",Suzuki,Carry,2013.0,Suzuki Carry Pro 2013,145000000,https://bonbanh.com/xe-suzuki-carry-pro-2013-4908872
4814746,Domestic assembly,Used car,Truck,0 Km,Green,Black,2-door,3-seat,Diesel,,Manual,RFD - Rear-wheel drive,L/100Km," I need to sell my other truck for 200k, Silver box, 2019 model, beautiful truck with no minor defects.",Kia,Frontier,2019.0,Kia Frontier K200 2019,279000000,https://bonbanh.com/xe-kia-frontier-k200-2019-4814746
4910322,Imported,Used car,Bán tải / Pickup,"80,000 Km",Sand,Black,4-door,5-seat,Diesel	2.2 L,,Manual,RFD - Rear-wheel drive,7	L/100Km," RANGER XLS MT_2017. 51D-Vehicle with invoice First registration: June 2017 Color: Yellow record Number of kilometers: 80,000km Included accessories: High trunk lid, heat insulation film, leather seats, floor lining",Ford,Ranger,2017.0,Ford Ranger XLS 2.2L 4x2 MT 2017,465000000,https://bonbanh.com/xe-ford-ranger-xls-2.2l-4x2-mt-2017-4910322
4815820,Domestic assembly,Used car,Sedan,"42,000 Km",White,Cream,4-door,5-seat,Petrol	1.4 L,Pump,Manual,FWD - Front-wheel drive,5	L/100Km," The car runs very well, the engine is strong, maintenance is done every 5000km, and all road tests are included. New, clean interior.",Hyundai,Accent,2020.0,Hyundai Accent 1.4 MT 2020,410000000,https://bonbanh.com/xe-hyundai-accent-1.4-mt-2020-4815820
4903398,Domestic assembly,Used car,Hatchback,0 Km,White,Cream,5-door,5-seat,Petrol	1.1 L,,Manual,FWD - Front-wheel drive,L/100Km,"KiA morning 2010, manual transmission Family car, women maintain it so it's still very new This car has enough toys, nothing is missing. You just buy it and go home, no need to clean it up anymore.",Kia,Morning,2010.0,Kia Morning LX 1.1 MT 2010,125000000,https://bonbanh.com/xe-kia-morning-lx-1.1-mt-2010-4903398
4048280,Domestic assembly,Used car,Sedan,"150,000 Km",White,Colorful,4-door,5-seat,Petrol	1.6 L,full electronic gasoline,Manual,FWD - Front-wheel drive,L/100Km,"Anh Ly Auto Supermarket sells a very nice 2012 Hyundai Avante 1.6 MT with provincial license plate and hand-drawn documents. The car is equipped with: high-quality leather seats, safety airbags, integrated steering wheel, electric mirrors,... .The car is still very new, beautiful interior and exterior, original machinery, body, good tires that do not need to be replaced, full car accessories such as reverse camera screen......The car has not crashed or crashed. flooded, original machine from the manufacturer. Support for transfer to owner's name, support for installment payments with preferential interest rates and quick procedures. Please contact for more detailed information!",Hyundai,Avante,2012.0,Hyundai Avante 1.6 MT 2012,285000000,https://bonbanh.com/xe-hyundai-avante-1.6-mt-2012-4048280
4884759,Domestic assembly,Used car,Crossover,"76,000 Km",Silver,White,5-door,8-seat,Petrol	2.0 L,Electricity,Manual,RFD - Rear-wheel drive,8	L/100Km,"I'm selling a 2017 manual transmission Innova, the car doesn't have any service business, nice car, anyone interested? Hello: How to check the mechanic or the company?",Toyota,Innova,2017.0,Toyota Innova 2.0E 2017 car,520000000,https://bonbanh.com/xe-toyota-innova-2.0e-2017-4884759
2446553,Domestic assembly,New car,Van/Minivan,0 Km,White,Silver,4-door,3-seat,Diesel	2.2 L,Turbo oil injection,Manual,RFD - Rear-wheel drive,9	L/100Km,"FORD TRANSIT 3-seat VALVE 940KGFord Transit renovated 3-seat van with large load capacity as well as being able to run in the city during rush hour, this is the outstanding advantage of this vehicle line.Ford Transit renovated 3-seat pickup van 940kg capacity is a very popular vehicle model today in Vietnamese urban areas. This Ford Transit pickup van line meets the needs of transporting goods during peak hours for businesses in rugged industries such as: Kim electrical appliances, fresh food, pharmaceuticals, mail, food testing vehicles, etc",Ford,Transit,2023.0,Ford Transit Van 940Kg 2023,849000000,https://bonbanh.com/xe-ford-transit-van-940kg-2023-2446553
4859201,Domestic assembly,Used car,Truck,"100,000 Km",White,White,2-door,2-seat,Petrol	1.0 L,,Manual,RFD - Rear-wheel drive,L/100Km," Excess house for sale to anyone who needs a fully air-conditioned car with new registration, contact 0919055083",Suzuki,Super Carry Truck,2006.0,Suzuki Super Carry Truck 1.0 MT 2006,72000000,https://bonbanh.com/xe-suzuki-super_carry_truck-1.0-mt-2006-4859201
4857581,Imported,Used car,SUV,0 Km,Black,Black,5-door,7-seat,Petrol	1.5 L,,Manual,FWD - Front-wheel drive,L/100Km, Xpander 2019 family car for sale urgent,Mitsubishi,Xpander,2019.0,Mitsubishi Xpander 1.5 MT 2019,460000000,https://bonbanh.com/xe-mitsubishi-xpander-1.5-mt-2019-4857581
4731392,Domestic assembly,Used car,Sedan,0 Km,Black,Black,4-door,5-seat,Petrol	1.4 L,,Manual,FWD - Front-wheel drive,L/100Km," For sale Aveo car produced 2018 privately owned 1 owner since new. Vehicle equipped. Electric mirrors, safety airbags, high-quality leather seats, DVD player... Guaranteed that the car will not crash or be flooded or flooded. Original engine and gearbox. For further information, please contact:",Chevrolet,Aveo,2018.0,Chevrolet Aveo LT 1.4 MT 2018,255000000,https://bonbanh.com/xe-chevrolet-aveo-lt-1.4-mt-2018-4731392
4515402,Imported,Used car,Bán tải / Pickup,"53,000 Km",Green,Brown,4-door,5-seat,Diesel	2.2 L,,Manual,RFD - Rear-wheel drive,L/100Km,"The car has not been crashed or flooded. COMMITMENTS - Standard legal - Lifetime Vehicle Service Support Commitment - Commitment to original chassis, engine, gearbox, no hydraulic shock, no paint color changes - Collect old cars and exchange them for new ones at high prices 2% more than the market. - 20,000km warranty (or 6 months to 1 year depending on the vehicle)",Ford,Ranger,2019.0,Ford Ranger XLS 2.2L 4x2 MT 2019,550000000,https://bonbanh.com/xe-ford-ranger-xls-2.2l-4x2-mt-2019-4515402
4806162,Imported,Used car,Bán tải / Pickup,0 Km,Grey,Black,4-door,5-seat,Diesel	2.2 L,,Manual,4WD - Four-wheel drive (4WD),L/100Km," The family has no need to use it so they need to sell the BT50. Imported car, 2 electric axles, manual transmission. Year 2017. The car still has a smooth and strong engine. Very economical on ingredients. The car has full body insurance. Lh. view car",Mazda,BT50,2017.0,Mazda BT50 2.2L 4x4 MT 2017,415000000,https://bonbanh.com/xe-mazda-bt50-2.2l-4x4-mt-2017-4806162
